[
  {
    "system": "http://snomed.info/sct",
    "code": "129006008",
    "display": "Walking",
    "display_zh": "步行"
  },
  {
    "system": "internal://motion_state",
    "code": "0002",
    "display": "Running",
    "display_zh": "奔跑"
  },
  {
    "system": "internal://motion_state",
    "code": "0004",
    "display": "Standing Still",
    "display_zh": "静止站立"
  },
  {
    "system": "http://snomed.info/sct",
    "code": "263821009",
    "display": "Static",
    "display_zh": "静止"
  },
  {
    "system": "http://snomed.info/sct",
    "code": "22325002",
    "display": "Abnormal Gait",
    "display_zh": "异常步态"
  },
  {
    "system": "http://snomed.info/sct",
    "code": "228439008",
    "display": "Slow Walking",
    "display_zh": "缓慢行走"
  },
  {
    "system": "http://snomed.info/sct",
    "code": "217082002",
    "display": "Falls",
    "display_zh": "跌倒"
  },
  {
    "system": "http://snomed.info/sct",
    "code": "10904000",
    "display": "Standing",
    "display_zh": "站立"
  },
  {
    "system": "http://snomed.info/sct",
    "code": "33586001",
    "display": "Sitting",
    "display_zh": "坐姿"
  },
  {
    "system": "http://snomed.info/sct",
    "code": "40199007",
    "display": "Lying Supine",
    "display_zh": "仰卧"
  },
  {
    "system": "http://snomed.info/sct",
    "code": "1240000",
    "display": "Lying Prone",
    "display_zh": "俯卧"
  },
  {
    "system": "http://snomed.info/sct",
    "code": "102538003",
    "display": "Lying Lateral",
    "display_zh": "侧卧"
  },
  {
    "system": "http://snomed.info/sct",
    "code": "102536004",
    "display": "Recumbent",
    "display_zh": "斜倚"
  },
  {
    "system": "internal://posture",
    "code": "0007",
    "display": "Crouching",
    "display_zh": "蹲伏"
  },
  {
    "system": "http://snomed.info/sct",
    "code": "3424008",
    "display": "Tachycardia",
    "display_zh": "心动过速"
  },
  {
    "system": "http://snomed.info/sct",
    "code": "48867003",
    "display": "Bradycardia",
    "display_zh": "心动过缓"
  },
  {
    "system": "http://snomed.info/sct",
    "code": "1023001",
    "display": "Apnea",
    "display_zh": "呼吸暂停"
  },
  {
    "system": "http://snomed.info/sct",
    "code": "258158006",
    "display": "Sleep",
    "display_zh": "睡眠"
  },
  {
    "system": "tdp://danger_level",
    "code": "tdp://danger_level/emergency",
    "display": "Emergency",
    "display_zh": "紧急"
  },
  {
    "system": "tdp://danger_level",
    "code": "tdp://danger_level/alert",
    "display": "Alert",
    "display_zh": "警报"
  },
  {
    "system": "tdp://danger_level",
    "code": "tdp://danger_level/critical",
    "display": "Critical",
    "display_zh": "危急"
  },
  {
    "system": "tdp://danger_level",
    "code": "tdp://danger_level/warning",
    "display": "Warning",
    "display_zh": "警告"
  },
  {
    "system": "tdp://danger_level",
    "code": "tdp://danger_level/normal",
    "display": "Normal",
    "display_zh": "正常"
  },
  {
    "system": "tdp://danger_level",
    "code": "tdp://danger_level/unknown",
    "display": "Unknown",
    "display_zh": "未知"
  },
  {
    "system": "internal://tag",
    "code": "fall_risk",
    "display": "Fall Risk",
    "display_zh": "跌倒风险"
  },
  {
    "system": "internal://tag",
    "code": "mobility_impaired",
    "display": "Mobility Impaired",
    "display_zh": "行动受限"
  },
  {
    "system": "internal://tag",
    "code": "elderly",
    "display": "Elderly",
    "display_zh": "老年人"
  },
  {
    "system": "internal://motion_state",
    "code": "0005",
    "display": "Lying Down",
    "display_zh": "躺下"
  },
  {
    "system": "internal://motion_state",
    "code": "0006",
    "display": "Sitting Down",
    "display_zh": "坐下"
  },
  {
    "system": "internal://posture",
    "code": "0011",
    "display": "Lying Prone",
    "display_zh": "俯卧"
  },
  {
    "system": "internal://danger_level",
    "code": "dl3",
    "display": "High Risk",
    "display_zh": "高风险"
  },
  {
    "system": "internal://danger_level",
    "code": "dl4",
    "display": "Critical",
    "display_zh": "严重风险"
  },
  {
    "system": "internal://tag",
    "code": "tag_001",
    "display": "New Tag 1",
    "display_zh": "新标签1"
  },
  {
    "system": "internal://tag",
    "code": "tag_002",
    "display": "New Tag 2",
    "display_zh": "新标签2"
  },
  {
    "system": "http://snomed.info/sct",
    "code": "383370001",
    "display": "Standing Position",
    "display_zh": "站立姿势"
  },
  {
    "system": "http://snomed.info/sct",
    "code": "402120000",
    "display": "Sitting Position",
    "display_zh": "坐姿"
  },
  {
    "system": "http://snomed.info/sct",
    "code": "109030009",
    "display": "Lying Position",
    "display_zh": "躺卧姿势"
  },
  {
    "system": "http://snomed.info/sct",
    "code": "26527006",
    "display": "Supine Position",
    "display_zh": "仰卧位"
  },
  {
    "system": "http://snomed.info/sct",
    "code": "271587009",
    "display": "Prone Position",
    "display_zh": "俯卧位"
  },
  {
    "system": "http://snomed.info/sct",
    "code": "414585002",
    "display": "Semi-Fowler's Position",
    "display_zh": "半卧位"
  },
  {
    "system": "http://snomed.info/sct",
    "code": "415568008",
    "display": "Moving",
    "display_zh": "移动中"
  },
  {
    "system": "http://snomed.info/sct",
    "code": "414549008",
    "display": "Standing Up",
    "display_zh": "起立中"
  },
  {
    "system": "http://snomed.info/sct",
    "code": "300845008",
    "display": "Sitting Down",
    "display_zh": "坐下中"
  },
  {
    "system": "http://snomed.info/sct",
    "code": "249911004",
    "display": "Shuffling Gait",
    "display_zh": "拖曳步态"
  },
  {
    "system": "http://snomed.info/sct",
    "code": "16973004",
    "display": "Ataxic Gait",
    "display_zh": "共济失调步态"
  },
  {
    "system": "http://snomed.info/sct",
    "code": "397776000",
    "display": "Freezing of Gait",
    "display_zh": "步态冻结"
  },
  {
    "system": "http://snomed.info/sct",
    "code": "22160007",
    "display": "Festinating Gait",
    "display_zh": "慌张步态"
  },
  {
    "system": "http://snomed.info/sct",
    "code": "1055001",
    "display": "Bradykinesia",
    "display_zh": "运动迟缓"
  },
  {
    "system": "http://snomed.info/sct",
    "code": "26079004",
    "display": "Tremor",
    "display_zh": "震颤"
  },
  {
    "system": "http://snomed.info/sct",
    "code": "314207007",
    "display": "Resting Tremor",
    "display_zh": "静止性震颤"
  },
  {
    "system": "http://snomed.info/sct",
    "code": "102557002",
    "display": "Difficulty Walking",
    "display_zh": "行走困难"
  },
  {
    "system": "http://snomed.info/sct",
    "code": "271823003",
    "display": "Abnormal Breathing",
    "display_zh": "异常呼吸"
  },
  {
    "system": "http://snomed.info/sct",
    "code": "30128008",
    "display": "Tachypnea",
    "display_zh": "呼吸过速"
  },
  {
    "system": "http://snomed.info/sct",
    "code": "248546003",
    "display": "Bradypnea",
    "display_zh": "呼吸过缓"
  },
  {
    "system": "http://snomed.info/sct",
    "code": "49817004",
    "display": "Irregular Heart Rate",
    "display_zh": "心率不规则"
  },
  {
    "system": "http://snomed.info/sct",
    "code": "271636001",
    "display": "Tachycardia Finding",
    "display_zh": "心动过速发现"
  },
  {
    "system": "http://snomed.info/sct",
    "code": "342400002",
    "display": "Bradycardia Finding",
    "display_zh": "心动过缓发现"
  },
  {
    "system": "http://snomed.info/sct",
    "code": "49049000",
    "display": "Parkinson's Disease",
    "display_zh": "帕金森病"
  },
  {
    "system": "http://snomed.info/sct",
    "code": "230690007",
    "display": "Cerebrovascular Accident",
    "display_zh": "脑血管意外"
  },
  {
    "system": "http://snomed.info/sct",
    "code": "22298006",
    "display": "Myocardial Infarction",
    "display_zh": "心肌梗死"
  },
  {
    "system": "http://snomed.info/sct",
    "code": "29857009",
    "display": "Chest Pain",
    "display_zh": "胸痛"
  },
  {
    "system": "http://snomed.info/sct",
    "code": "129839007",
    "display": "At Risk for Falls",
    "display_zh": "跌倒风险"
  },
  {
    "system": "http://snomed.info/sct",
    "code": "225602000",
    "display": "Unable to Sit Unsupported",
    "display_zh": "无法独立坐稳"
  },
  {
    "system": "http://snomed.info/sct",
    "code": "17535004",
    "display": "Lying in Bed",
    "display_zh": "躺在床上"
  },
  {
    "system": "http://snomed.info/sct",
    "code": "43029002",
    "display": "Abnormal Posture",
    "display_zh": "异常姿势"
  },
  {
    "system": "internal://tag",
    "code": "Apnea.Confirmed",
    "display": "Apnea Confirmed",
    "display_zh": "确诊呼吸暂停"
  },
  {
    "system": "internal://tag",
    "code": "Apnea.Suspected",
    "display": "Apnea Suspected",
    "display_zh": "疑似呼吸暂停"
  },
  {
    "system": "internal://tag",
    "code": "CardiacPause.Confirmed",
    "display": "Cardiac Pause Confirmed",
    "display_zh": "确诊心率暂停"
  },
  {
    "system": "internal://tag",
    "code": "CardiacPause.Suspected",
    "display": "Cardiac Pause Suspected",
    "display_zh": "疑似心率暂停"
  },
  {
    "system": "internal://tag",
    "code": "Convulsion",
    "display": "Convulsion",
    "display_zh": "抽搐"
  },
  {
    "system": "internal://tag",
    "code": "Convulsion.Suspected",
    "display": "Convulsion Suspected",
    "display_zh": "疑似抽搐"
  },
  {
    "system": "internal://tag",
    "code": "Fall.Suspected",
    "display": "Fall Suspected",
    "display_zh": "疑似跌倒"
  },
  {
    "system": "internal://tag",
    "code": "OnFloor",
    "display": "On Floor",
    "display_zh": "在地面上"
  },
  {
    "system": "internal://tag",
    "code": "ProlongedStay",
    "display": "Prolonged Stay",
    "display_zh": "长时间滞留"
  },
  {
    "system": "internal://tag",
    "code": "NoTurning",
    "display": "No Turning",
    "display_zh": "未翻身"
  },
  {
    "system": "internal://tag",
    "code": "LyingInBed",
    "display": "Lying in Bed",
    "display_zh": "躺床"
  },
  {
    "system": "internal://tag",
    "code": "SittingInBed",
    "display": "Sitting in Bed",
    "display_zh": "床上坐起"
  },
  {
    "system": "internal://tag",